{
  "schemaVersion": 1,
  "status": "live_action_card_examples",
  "name": "Boreal Agent Action Card Examples",
  "description": "Checked example cards for agents rendering human-first Boreal action UX. Cards can recommend what to show or prepare, but they do not grant permission, record approval, authorize payment, prove completion, or create durable truth.",
  "sourceProfiles": [
    {
      "label": "Agent action playbook",
      "url": "https://boreal.work/agents/actions.md",
      "observedStatus": "public_playbook"
    },
    {
      "label": "Agent action preflight endpoint",
      "url": "https://boreal.work/agents/actions/preflight",
      "observedStatus": "live_validation_only"
    },
    {
      "label": "Agent UX profile",
      "url": "https://boreal.work/agents/ux.json",
      "observedStatus": "live_agent_ux_profile"
    },
    {
      "label": "Agent human handoff profile",
      "url": "https://boreal.work/agents/human-handoffs.json",
      "observedStatus": "live_human_handoff_profile"
    },
    {
      "label": "Agent recovery profile",
      "url": "https://boreal.work/agents/recovery.json",
      "observedStatus": "live_recovery_profile"
    }
  ],
  "cardContract": {
    "status": "derived_example_only",
    "requiredFields": [
      "actionId",
      "title",
      "availability",
      "visualState",
      "primaryAction",
      "canonicalReads",
      "canonicalWritesIfActionTaken",
      "requiredBeforeMutation",
      "humanDecisionRequired",
      "safeRenderClaims",
      "notAuthority"
    ],
    "recommendedFields": [
      "sourceSurface",
      "evidenceToShow",
      "supportingActions",
      "handoffCopy",
      "recoveryIfBlocked",
      "examplePayloadSummary"
    ],
    "agentMustNot": [
      "treat an action card as permission to mutate Boreal state",
      "treat a rendered card as a human approval record",
      "treat a successful preflight as a Commitment proposal",
      "treat payment readiness as payment authorization",
      "treat proof submission as owner acceptance or completion",
      "write heartbeat, cursor, or local optimization state as RequestEvent truth"
    ]
  },
  "examples": [
    {
      "id": "human_request_draft_card",
      "status": "example_only",
      "actionId": "make_request_for_human",
      "title": "Draft a request for the human owner",
      "role": "requester",
      "availability": "live_authenticated_http_contract",
      "scenario": "A signed-in buyer asks an agent to turn a messy need into a private Boreal draft before opening it to supply.",
      "sourceSurface": "owner_draft",
      "visualState": {
        "label": "Draft needs human review",
        "tone": "needs_review",
        "summary": "A draft Request can be prepared, but opening, funding, or routing still needs explicit human approval."
      },
      "primaryAction": {
        "label": "Create draft Request",
        "method": "POST",
        "href": "https://boreal.work/api/requests",
        "requiresHumanReview": true,
        "idempotencyRequired": true
      },
      "supportingActions": [
        {
          "label": "Check action preflight",
          "method": "POST",
          "href": "https://boreal.work/agents/actions/preflight",
          "requiresHumanReview": false,
          "idempotencyRequired": false
        }
      ],
      "canonicalReads": [
        "Request"
      ],
      "canonicalWritesIfActionTaken": [
        "Request"
      ],
      "requiredBeforeMutation": [
        "Boreal account session",
        "buyer-authored brief fields only",
        "explicit human review before opening the request",
        "idempotency key where the route supports it"
      ],
      "humanDecisionRequired": true,
      "evidenceToShow": [
        "buyer-authored summary",
        "missing scope questions",
        "budget or timing unknowns",
        "proof expectations"
      ],
      "safeRenderClaims": [
        "Draft prepared for review",
        "Not opened",
        "No supply selected"
      ],
      "handoffCopy": "Review this draft before opening it. I will not publish, route, or fund it until you approve.",
      "notAuthority": [
        "not opened Request",
        "not Commitment",
        "not funding approval",
        "not assignment",
        "not completion proof"
      ],
      "recoveryIfBlocked": [
        "Ask one missing briefing question.",
        "Keep the draft local if account auth or owner approval is missing.",
        "Do not write planner-owned fields directly."
      ],
      "examplePayloadSummary": {
        "brief": "Owner-authored summary and acceptance criteria.",
        "visibility": "private_draft",
        "durableWrite": true,
        "opensRequest": false
      }
    },
    {
      "id": "apply_to_request_card",
      "status": "example_only",
      "actionId": "apply_to_request",
      "title": "Apply to this request",
      "role": "solver",
      "availability": "live_authenticated_http_contract",
      "scenario": "A represented solver or supply agent wants to propose work on a public request.",
      "sourceSurface": "request_detail",
      "visualState": {
        "label": "Ready to propose",
        "tone": "ready",
        "summary": "The card can render an apply action after policy and scope checks, but applying creates only a proposed Commitment."
      },
      "primaryAction": {
        "label": "Submit Commitment proposal",
        "method": "POST",
        "href": "https://boreal.work/api/requests/{id}/commitments",
        "requiresHumanReview": true,
        "idempotencyRequired": true
      },
      "supportingActions": [
        {
          "label": "Read request policy",
          "method": "GET",
          "href": "https://boreal.work/api/requests/{id}",
          "requiresHumanReview": false,
          "idempotencyRequired": false
        },
        {
          "label": "Validate action prerequisites",
          "method": "POST",
          "href": "https://boreal.work/agents/actions/preflight",
          "requiresHumanReview": false,
          "idempotencyRequired": false
        }
      ],
      "canonicalReads": [
        "Request",
        "Supply"
      ],
      "canonicalWritesIfActionTaken": [
        "Commitment",
        "RequestEvent"
      ],
      "requiredBeforeMutation": [
        "represented actor authorization",
        "agentActionPolicy allows apply_to_request",
        "commitments:propose scope when resolver bearer is used",
        "human review of price, scope, proof, timing, and handoff terms",
        "idempotency key"
      ],
      "humanDecisionRequired": true,
      "evidenceToShow": [
        "public request title and acceptance criteria",
        "solver capability match",
        "proposed price or terms",
        "proof and handoff commitments"
      ],
      "safeRenderClaims": [
        "Proposal ready",
        "Waiting for owner acceptance",
        "No fulfillment started"
      ],
      "handoffCopy": "Approve this proposal text before I submit it as a Commitment candidate.",
      "notAuthority": [
        "not permission grant",
        "not accepted Commitment",
        "not assignment",
        "not fulfillment start",
        "not payment authorization",
        "not completion proof"
      ],
      "recoveryIfBlocked": [
        "If scope is missing, render questions instead of submitting.",
        "If policy blocks apply_to_request, switch to monitor_request or stop.",
        "If idempotency is uncertain, do not retry blindly."
      ],
      "examplePayloadSummary": {
        "commitmentKind": "proposal",
        "includesPrice": true,
        "includesProofPlan": true,
        "claimsAssignment": false
      }
    },
    {
      "id": "submit_artifact_card",
      "status": "example_only",
      "actionId": "submit_artifact",
      "title": "Submit proof or delivery",
      "role": "solver",
      "availability": "live_authenticated_http_contract",
      "scenario": "A solver has output, proof, media, receipt, or delivery notes ready for owner review.",
      "sourceSurface": "workroom",
      "visualState": {
        "label": "Proof submitted, waiting for review",
        "tone": "proof_submitted",
        "summary": "Artifact submission can package proof, but completion remains pending until review or lifecycle truth supports it."
      },
      "primaryAction": {
        "label": "Publish Artifact for review",
        "method": "POST",
        "href": "https://boreal.work/api/requests/{id}/artifacts",
        "requiresHumanReview": true,
        "idempotencyRequired": true
      },
      "supportingActions": [
        {
          "label": "Validate evidence packet",
          "method": "POST",
          "href": "https://boreal.work/agents/evidence/validate",
          "requiresHumanReview": false,
          "idempotencyRequired": false
        },
        {
          "label": "Validate completion claim",
          "method": "POST",
          "href": "https://boreal.work/agents/completion/validate",
          "requiresHumanReview": false,
          "idempotencyRequired": false
        }
      ],
      "canonicalReads": [
        "Request",
        "Commitment",
        "Fulfillment"
      ],
      "canonicalWritesIfActionTaken": [
        "Artifact",
        "RequestEvent"
      ],
      "requiredBeforeMutation": [
        "artifact:publish or equivalent authorized session",
        "no secrets, private keys, raw prompt internals, or raw local runtime logs",
        "bounded proof claims",
        "redaction statement",
        "idempotency key where supported"
      ],
      "humanDecisionRequired": true,
      "evidenceToShow": [
        "artifact title",
        "artifact kind",
        "proof claims",
        "redaction statement",
        "review request"
      ],
      "safeRenderClaims": [
        "Proof submitted, waiting for review",
        "Artifact candidate created",
        "Completion not yet accepted"
      ],